Category-en,Category-zh
"Sports Outdoors Outdoor Recreation Skates, Skateboards Scooters Skateboarding Standard Skateboards Longboards Longboards",[{'translation_text': 'zheng/公仔 玩具 玩具车船飞机 玩具车船飞机'}]
Toys Games Learning Education Science Kits Toys,[{'translation_text': 'zheng/公仔 玩具 玩具车船飞机 玩具车船飞机'}]
Toys Games Arts Crafts Craft Kits,[{'translation_text': 'zheng/ 天堂 餐饮/餐饮 厨具/厨房DIY用品 食品/'}]
Toys Games Hobbies Models Model Kits Model Kits Airplane Jet Kits,[{'translation_text': 'zheng/ 天堂 餐饮 餐具 餐具 餐具 餐具 餐具 餐具 餐具 餐具'}]
Toys Games Puzzles Jigsaw Puzzles,[{'translation_text': 'zheng/公仔 玩具 玩具车船飞机 玩具车船飞机'}]
"Clothing, Shoes Jewelry Costumes Accessories Kids Baby Girls Costumes",[{'translation_text': 'zheng 电子产品 电子配件 供电设备 电池 电池'}]
Toys Games Arts Crafts Drawing Painting Supplies Crayons,[{'translation_text': 'zheng/公仔 玩具 玩具车船飞机 玩具车船飞机'}]
Home Kitchen Home Decor Window Treatments Window Stickers Films Window Films,[{'translation_text': 'zheng/公仔 玩具 玩具车船飞机 玩具车船飞机'}]
Toys Games Baby Toddler Toys,[{'translation_text': 'zheng/公仔 玩具 玩具车船飞机 玩具车船飞机'}]
"Toys Games Collectible Toys Statues, Bobbleheads Busts Statues",[{'translation_text': 'zheng/公仔 玩具 玩具车船飞机 玩具车船飞机'}]
Baby Products Nursery decor Window Treatments Valances,[{'translation_text': 'zheng 办公用品 办公耗材 办公耗材 办公耗材 办公耗材 办公耗材 办公耗材 办公耗材'}]
Toys Games Building Toys Building Sets,[{'translation_text': 'zheng/公仔 玩具 玩具车船飞机 玩具车船飞机'}]
Toys Games Arts Crafts Craft Kits,[{'translation_text': 'zheng/ 天堂 餐饮/餐饮 厨具/厨房DIY用品 食品/'}]
Toys Games Baby Toddler Toys Musical Toys,[{'translation_text': 'zheng/公仔 玩具 玩具车船飞机 玩具车船飞机'}]
Toys Games Learning Education Flash Cards,[{'translation_text': 'zheng/市政/医疗/服务 医疗/医院专用设备 医用家具 医用家具 医用家具 医用家具 医用家具'}]
Home Kitchen Furniture Kids' Furniture Tables Chairs Tables,[{'translation_text': 'zheng/公仔 玩具 玩具车船飞机 玩具车船飞机'}]
Toys Games Novelty Gag Toys Money Banks,[{'translation_text': 'zheng/公仔 玩具 玩具车船飞机 玩具车船飞机'}]
Toys Games Baby Toddler Toys Musical Toys,[{'translation_text': 'zheng/公仔 玩具 玩具车船飞机 玩具车船飞机'}]
Toys Games Sports Outdoor Play Slumber Bags,[{'translation_text': 'zheng/公仔 玩具 玩具车船飞机 玩具车船飞机'}]
Toys Games Hobbies Hobby Building Tools Hardware RC Linkages,[{'translation_text': 'zheng/公仔 玩具 玩具车船飞机 玩具车船飞机'}]
Toys Games Building Toys Building Sets,[{'translation_text': 'zheng/公仔 玩具 玩具车船飞机 玩具车船飞机'}]
Toys Games Party Supplies Party Tableware Plates,[{'translation_text': 'zheng/公仔 玩具 玩具车船飞机 玩具车船飞机'}]
Toys Games Baby Toddler Toys Teaching Clocks,[{'translation_text': 'zheng/公仔 玩具 玩具车船飞机 玩具车船飞机'}]
"Toys Games Tricycles, Scooters Wagons Balance Bikes",[{'translation_text': 'zheng/公仔 玩具 玩具车船飞机 玩具车船飞机'}]
Toys Games Kids' Electronics,[{'translation_text': 'zh?n? c?e?e?/i?/'}]
Home Kitchen Home decor Kids' Room decor,[{'translation_text': 'zheng/公仔 玩具 玩具车船飞机 玩具车船飞机'}]
Baby Products Nursery decor Wall decor Growth Charts,[{'translation_text': 'zheng 电子产品 电子配件 供电设备 电池 电池'}]
Toys Games Puzzles Jigsaw Puzzles,[{'translation_text': 'zheng/公仔 玩具 玩具车船飞机 玩具车船飞机'}]
Sports Outdoors Sports Fitness Team Sports,[{'translation_text': 'zheng/ 天堂 交通工具/汽车/飞机/船舶 交通工具零配件 机动车/汽车/摩托车零部件 汽车引擎零件 汽车引擎零件'}]
Toys Games Dress Up Pretend Play Costumes,[{'translation_text': 'zheng/公仔 玩具 玩具车船飞机 玩具车船飞机'}]
Home Kitchen Bedding Kids' Bedding Comforters Sets Comforter Sets,[{'translation_text': 'zheng/公仔 玩具 玩具车船飞机 玩具车船飞机'}]
Toys Games Toy Figures Playsets Action Figures,[{'translation_text': 'zheng/公仔 玩具 玩具车船飞机 玩具车船飞机'}]
"Clothing, Shoes Jewelry Costumes Accessories Kids Baby Boys Costumes",[{'translation_text': 'zheng 电子产品 电子配件 供电设备 电池 电池'}]
Toys Games Play Vehicles,[{'translation_text': 'zheng/公仔 玩具 玩具车船飞机 玩具车船飞机'}]
Toys Games Novelty Gag Toys,[{'translation_text': 'zheng/公仔 玩具 玩具车船飞机 玩具车船飞机'}]
Toys Games Party Supplies,[{'translation_text': 'zheng/公仔 玩具 玩具车船飞机 玩具车船飞机'}]
Toys Games Party Supplies Banners,[{'translation_text': 'zheng/公仔 玩具 玩具车船飞机 玩具车船飞机'}]
Toys Games Dolls Accessories Doll Accessories,[{'translation_text': 'zheng/公仔 玩具 玩具车船飞机 玩具车船飞机'}]
Toys Games Arts Crafts Craft Kits,[{'translation_text': 'zheng/ 天堂 餐饮/餐饮 厨具/厨房DIY用品 食品/'}]
Toys Games Games Accessories,[{'translation_text': 'zheng/公仔 玩具 玩具车船飞机 玩具车船飞机'}]
Toys Games Hobbies Trains Accessories Train Cars Freight Cars Gondolas,[{'translation_text': 'zheng/ 天堂 餐饮 餐具 餐具 餐具 餐具 餐具 餐具 餐具'}]
Home Kitchen Bedding Kids' Bedding Blankets Throws Throws,[{'translation_text': 'zheng/公仔 玩具 玩具车船飞机 玩具车船飞机'}]
Pet Supplies Dogs Training Behavior Aids Agility Equipment Tunnels,[{'translation_text': 'zheng/公仔 玩具 玩具车船飞机 玩具车船飞机'}]
Toys Games Dolls Accessories Dolls,[{'translation_text': 'zheng/公仔 玩具 玩具车船飞机 玩具车船飞机'}]
Toys Games Hobbies Remote App Controlled Vehicles Parts Remote App Controlled Vehicle Parts,[{'translation_text': 'zheng/ 天堂 五金/装修 水暖建材 水管装置 淋浴设备 淋浴机'}]
Toys Games Learning Education,[{'translation_text': 'zheng/公仔 玩具 玩具车船飞机 玩具车船飞机'}]
Toys Games Kids' Electronics Electronic Learning Toys,[{'translation_text': 'zheng/公仔 玩具 玩具车船飞机 玩具车船飞机'}]
"Clothing, Shoes Jewelry Novelty More Clothing Novelty Men Shirts T-Shirts",[{'translation_text': 'zheng/公仔 玩具 玩具车船飞机 玩具车船飞机'}]
Toys Games Hobbies Hobby Building Tools Hardware Paints,[{'translation_text': 'zheng/公仔 玩具 玩具车船飞机 玩具车船飞机'}]
Toys Games Arts Crafts,[{'translation_text': 'zheng/公仔 玩具 玩具车船飞机 玩具车船飞机'}]
Toys Games Games Accessories Card Games,[{'translation_text': 'zheng/公仔 玩具 玩具车船飞机 玩具车船飞机'}]
Toys Games Dress Up Pretend Play Pretend Play Kitchen Toys,[{'translation_text': 'zheng/公/市 公/市 公/市政部件 标签 标签 标签 标签 标签'}]
Toys Games Dolls Accessories Dolls,[{'translation_text': 'zheng/公仔 玩具 玩具车船飞机 玩具车船飞机'}]
Toys Games Kids' Electronics Electronic Learning Toys,[{'translation_text': 'zheng/公仔 玩具 玩具车船飞机 玩具车船飞机'}]
Toys Games Games Accessories,[{'translation_text': 'zheng/公仔 玩具 玩具车船飞机 玩具车船飞机'}]
"Clothing, Shoes Jewelry Men Accessories Wallets, Card Cases Money Organizers Wallets",[{'translation_text': 'zheng 电子产品 电子配件 供电设备 电池 电池'}]
Toys Games Toy Figures Playsets Action Figures,[{'translation_text': 'zheng/公仔 玩具 玩具车船飞机 玩具车船飞机'}]
Toys Games Baby Toddler Toys,[{'translation_text': 'zheng/公仔 玩具 玩具车船飞机 玩具车船飞机'}]
Toys Games Baby Toddler Toys Sorting Stacking Toys,[{'translation_text': 'zheng/公仔 玩具 玩具车船飞机 玩具车船飞机'}]
"Toys Games Collectible Toys Statues, Bobbleheads Busts Statues",[{'translation_text': 'zheng/公仔 玩具 玩具车船飞机 玩具车船飞机'}]
"Clothing, Shoes Jewelry Costumes Accessories Women Wigs",[{'translation_text': 'zheng 电子产品 电子配件 供电设备 电池 电池'}]
Toys Games Toy Figures Playsets Action Figures,[{'translation_text': 'zheng/公仔 玩具 玩具车船飞机 玩具车船飞机'}]
Toys Games Toy Figures Playsets Action Figures,[{'translation_text': 'zheng/公仔 玩具 玩具车船飞机 玩具车船飞机'}]
Toys Games Stuffed Animals Plush Toys Stuffed Animals Teddy Bears,[{'translation_text': 'zheng/公仔 玩具 玩具车船飞机 玩具车船飞机'}]
Toys Games Dolls Accessories Dolls,[{'translation_text': 'zheng/公仔 玩具 玩具车船飞机 玩具车船飞机'}]
Toys Games Dolls Accessories Playsets,[{'translation_text': 'zheng/公仔 玩具 玩具车船飞机 玩具车船飞机'}]
Toys Games Stuffed Animals Plush Toys Stuffed Animals Teddy Bears,[{'translation_text': 'zheng/公仔 玩具 玩具车船飞机 玩具车船飞机'}]
Toys Games Novelty Gag Toys Miniatures,[{'translation_text': 'zheng/公仔 玩具 玩具车船飞机 玩具车船飞机'}]
Toys Games Stuffed Animals Plush Toys Plush Puppets,[{'translation_text': 'zheng/公仔 玩具 玩具车船飞机 玩具车船飞机'}]
Toys Games Hobbies Remote App Controlled Vehicles Parts Remote App Controlled Vehicle Parts Wheels Tires Tires,[{'translation_text': 'zheng/公仔 玩具 玩具车船飞机 玩具车船飞机'}]
Home Kitchen Home decor Kids' Room decor Wall decor,[{'translation_text': 'zheng/公仔 玩具 玩具车船飞机 玩具车船飞机'}]
Toys Games Stuffed Animals Plush Toys Plush Figures,[{'translation_text': 'zheng/公仔 玩具 玩具车船飞机 玩具车船飞机'}]
Toys Games Hobbies Remote App Controlled Vehicles Parts Remote App Controlled Vehicle Parts Power Plant Driveline Systems Axles,[{'translation_text': 'zheng/ 天堂 五金/装修 水暖建材 水管装置 淋浴设备 淋浴机'}]
Sports Outdoors Sports Fitness Team Sports Volleyball Volleyballs Outdoor Volleyballs,[{'translation_text': 'zheng/ 天堂 交通工具/汽车/飞机/船舶 交通工具零配件 机动车/汽车/摩托车零部件 汽车引擎零件 汽车引擎零件'}]
Toys Games Toy Figures Playsets Playsets Vehicles Playsets,[{'translation_text': 'zheng/公仔 玩具 玩具车船飞机 玩具车船飞机'}]
Toys Games Arts Crafts Clay Dough,[{'translation_text': 'zheng/公仔 玩具 玩具车船飞机 玩具车船飞机'}]
Toys Games Games Accessories Board Games,[{'translation_text': 'zheng/公仔 玩具 玩具车船飞机 玩具车船飞机'}]
Toys Games Stuffed Animals Plush Toys Plush Figures,[{'translation_text': 'zheng/公仔 玩具 玩具车船飞机 玩具车船飞机'}]
Toys Games Games Accessories Game Accessories Standard Game Dice,[{'translation_text': 'zheng/公仔 玩具 玩具车船飞机 玩具车船飞机'}]
Toys Games Kids' Electronics,[{'translation_text': 'zh?n? c?e?e?/i?/'}]
Toys Games Dolls Accessories Dolls,[{'translation_text': 'zheng/公仔 玩具 玩具车船飞机 玩具车船飞机'}]
Sports Outdoors Fan Shop Toys Game Room Games,[{'translation_text': 'zheng/ 天堂 交通工具/汽车/飞机/船舶 交通工具零配件 机动车/汽车/摩托车零部件 汽车引擎零件 汽车引擎零件'}]
Toys Games Dress Up Pretend Play Pretend Play Kitchen Toys Play Food,[{'translation_text': 'zheng/公/市 公/市 公/市政部件 标签 标签 标签 标签'}]
Toys Games Party Supplies Banners,[{'translation_text': 'zheng/公仔 玩具 玩具车船飞机 玩具车船飞机'}]
Toys Games Baby Toddler Toys,[{'translation_text': 'zheng/公仔 玩具 玩具车船飞机 玩具车船飞机'}]
Toys Games Hobbies Trains Accessories Train Cars,[{'translation_text': 'zheng/公仔 玩具 玩具车船飞机 玩具车船飞机'}]
Toys Games Games Accessories Card Games Standard Playing Card Decks,[{'translation_text': 'zheng/公仔 玩具 玩具车船飞机 玩具车船飞机'}]
Toys Games Stuffed Animals Plush Toys,[{'translation_text': 'zheng/公仔 玩具 玩具车船飞机 玩具车船飞机'}]
Toys Games Hobbies Remote App Controlled Vehicles Parts Remote App Controlled Vehicle Parts,[{'translation_text': 'zheng/ 天堂 五金/装修 水暖建材 水管装置 淋浴设备 淋浴机'}]
Toys Games Kids' Electronics,[{'translation_text': 'zh?n? c?e?e?/i?/'}]
Toys Games Games Accessories Card Games Standard Playing Card Decks,[{'translation_text': 'zheng/公仔 玩具 玩具车船飞机 玩具车船飞机'}]
Toys Games Hobbies Remote App Controlled Vehicles Parts Remote App Controlled Vehicles Quadcopters Multirotors,[{'translation_text': 'zheng/公仔 玩具 玩具车船飞机 玩具车船飞机'}]
"Arts, Crafts Sewing Crafting Paper Paper Crafts Paper Craft Tools",[{'translation_text': 'zheng/公仔 玩具 玩具车船飞机 玩具车船飞机'}]
Toys Games Building Toys,[{'translation_text': 'zheng/公仔 玩具 玩具车船飞机 玩具车船飞机'}]
Toys Games Party Supplies,[{'translation_text': 'zheng/公仔 玩具 玩具车船飞机 玩具车船飞机'}]
"Clothing, Shoes Jewelry Costumes Accessories Kids Baby Girls Costumes",[{'translation_text': 'zheng 电子产品 电子配件 供电设备 电池 电池'}]
Toys Games Learning Education Science Kits Toys,[{'translation_text': 'zheng/公仔 玩具 玩具车船飞机 玩具车船飞机'}]
Toys Games Dolls Accessories Dolls,[{'translation_text': 'zheng/公仔 玩具 玩具车船飞机 玩具车船飞机'}]
Toys Games Sports Outdoor Play Play Sets Playground Equipment,[{'translation_text': 'zheng/公仔 玩具 玩具车船飞机 玩具车船飞机'}]
Toys Games Stuffed Animals Plush Toys Plush Pillows,[{'translation_text': 'zheng/公仔 玩具 玩具车船飞机 玩具车船飞机'}]
